{
  "$schema": "http://json-schema.org/draft-07/schema#",
  "$id": "https://squad-delivery/skills/review-backend-code/schemas/input.json",
  "title": "review-backend-code input",
  "description": "ADVISORY — documents the assembled stage input; the engine validates workflow input and stage OUTPUTS only (engine/validation.py). Shape below is the POST-adapter payload delivered at stage backend-review.",
  "type": "object",
  "required": [
    "files_generated",
    "tests_generated",
    "api_contracts",
    "idempotency_key"
  ],
  "additionalProperties": false,
  "properties": {
    "files_generated": {
      "type": "array",
      "description": "Shape: implement-backend-feature schemas/output.json#/properties/files_generated. Production files emitted by step 4. At least one entry. Empty array is invalid — a Generate stage that emits no files must signal loop_back instead."
    },
    "tests_generated": {
      "type": "array",
      "description": "Shape: implement-backend-feature schemas/output.json#/properties/tests_generated. Companion test files emitted by step 5. At least one entry — banking-grade Generate never emits production without tests."
    },
    "api_contracts": {
      "type": "object",
      "description": "Shape: designing-tech-lead-handoff schemas/output.json#/properties/api_contracts. Verbatim shape of templates/tech-lead-contracts.md embedded schema. These are the cross-component INTERFACE contracts (the architecture's connective tissue), NOT per-service endpoint specs. payload_shape is intentionally open (free-form JSON-Schema-ish object per the template)."
    },
    "idempotency_key": {
      "type": "string",
      "description": "engine-injected: the workflow's single idempotency key, injected into every stage payload."
    },
    "upstream_artifacts": {
      "type": "object",
      "description": "engine-injected: map of producer stage id to its artifact path relative to this stage's dir.",
      "additionalProperties": {
        "type": "string"
      }
    },
    "loop_back_feedback": {
      "type": "object",
      "description": "engine-injected (conditional): reviewer findings threaded into a re-run after a loop_back."
    }
  }
}
